source,auteur,date,phrase,aspect,sentiment
page_NSIA,Gnolou Adonay,2025-08-01,en 2023 après l ouverture de mon compte j ai été facturer l argent de la carte bancaire j étais aller au village bien avant ça je passais régulièrement pour demander si la carte étais prête jamais j ai reçu de retour et j ai effectivement effectué le voyage quelque temps après je me suis rendus au nord ferker donc jai voulus faire un dépôt sur mon compte et sais la je pose la questions madame est ce que il est possible de vérifier si ma carte est prête sais la elles vas me faire sortir le mots de la carte a été détruit après 6mois il restais un peux jallait pleurer ca ma décourager même jai plus déposer djaaiii la franchement revoyer ce coter si j avais reçue de message jallait récupérer ma carte si on m avais aussi dis qu après 6 mois sans récupérer elle sera détruite jallait pas accepter l achat jai mal hein je vous aiment mais laaaaaalaaaaa vous aviez saheeeeeeeee jai trois coppte bancaire mais pour vous la ma tellement plus,carte,positif
page_NSIA,Kone Soum,2025-08-06,là où je suis je n avais jamais envisagé quitter cette banque mais là où je suis je suis très déçu de nsia vraiment pour un simple rachat sur ton assurance on te fait tourner comme si tu voulais pas d urgence avec vous vous faites souscrire à des assurances que vous ne contrôler pas au moment de la reverser au clients,service client,negatif
page_NSIA,Kone Soum,2025-08-06,là où je suis je n avais jamais envisagé quitter cette banque mais là où je suis je suis très déçu de nsia vraiment pour un simple rachat sur ton assurance on te fait tourner comme si tu voulais pas d urgence avec vous vous faites souscrire à des assurances que vous ne contrôler pas au moment de la reverser au clients,assurance,negatif
page_NSIA,André Koffi Ettien,2025-07-31,c est comme ça que vous faites une fois en agence ce n est plus les mêmes réalités franchement nsia banque,agence,negatif
page_NSIA,Ibrahim Al-waleed Dosso,2025-07-24,la maintenance du réseau nsia assurance,assurance,negatif
page_NSIA,Joel Koffi,2025-07-31,c est que les frais de dossier seront exorbitants,frais,negatif
page_NSIA,Kafaga Silué,2025-07-24,donnez nous le taux d intérêt ttc appliqué au prêt,application,negatif
page_NSIA,Ibrahim Al-waleed Dosso,2025-07-24,agence bouake,agence,negatif
page_NSIA,Christ Duffi,2025-07-31,besoin d un commercial nsia assurance,assurance,negatif
page_NSIA,Donateur Soro,2025-07-31,mon application est bloqué,application,negatif
page_NSIA,Lyse-marie Marilyne Marco,2025-07-24,pourquoi les cartes bancaires reliées au compte sont payantes ce service doit être gratuit comme cela se fait ailleurs pareil pour le service de banque en ligne,service client,negatif
page_NSIA,Lyse-marie Marilyne Marco,2025-07-24,pourquoi les cartes bancaires reliées au compte sont payantes ce service doit être gratuit comme cela se fait ailleurs pareil pour le service de banque en ligne,carte,negatif
page_NSIA,Sidibe Korotoum,2025-07-24,moi j attends juste qu on revienne à l ancien plafonnage des cartes magnétiques,carte,negatif
page_NSIA,Ibrahima Traore,2025-07-24,avant de faire la pub de nouvelles carte pensé à résoudre le problème de transfert de carte merci,carte,negatif
page_NSIA,Jean-Pierre Urb,2025-07-24,cette banque est une pourriture et pire ce docha du dépôt assurances lui sait de quoi je vocales avec le dossier,assurance,negatif
page_NSIA,Siaka Sylla Ibn Cheick,2025-07-24,affaire de transfert de carte bancaire à nsia banque,carte,positif
page_NSIA,Lyse-marie Marilyne Marco,2025-07-17,une simple opération de 10 mn quand on se rend en agence on peut perdre facilement 1h pourquoi ne pas permettre cette mise à jour en ligne pour ceux qui ont le service en ligne,service client,negatif
page_NSIA,Lyse-marie Marilyne Marco,2025-07-17,une simple opération de 10 mn quand on se rend en agence on peut perdre facilement 1h pourquoi ne pas permettre cette mise à jour en ligne pour ceux qui ont le service en ligne,agence,negatif
page_NSIA,Loreine Currie,2025-07-17,bonjour nsia moi je viens pour poser une question j ai perdu ma carte cni j ai fais la déclaration de perte on m a donné un récépissé est ce que je peux faire un retrait avec ça,retrait,positif
page_NSIA,Loreine Currie,2025-07-17,bonjour nsia moi je viens pour poser une question j ai perdu ma carte cni j ai fais la déclaration de perte on m a donné un récépissé est ce que je peux faire un retrait avec ça,carte,positif
page_NSIA,Garçon Fôrmïdàble,2025-07-17,a combien s élèvent le frais de tenue de compte pour ceux qui ont déjà un compte à nsia j aimerais faire l ouverture de mon compte mais je veux juste savoir merci,frais,positif
page_NSIA,Adou Rachel,2025-07-17,qui connaît la différence entre toute les couleurs des cartes bancaires nsia,carte,positif
page_NSIA,Autorité John Olive,2025-07-10,avec tout ça vous êtes dernier à faire à virement,virement,negatif
page_NSIA,Sicka Yasoi Sran,2025-07-10,autorité john olive toujours ils sont en retard dans virements,virement,negatif
page_NSIA,Salimanou Akogbè,2025-07-10,faire moi le virement dans mon compte,virement,negatif
page_NSIA,Kouame Hermann Charles,2025-07-10,je réside loin d une agence nsia que dois je faire,agence,negatif
page_NSIA,Bob Alex Tiemoko,2025-07-10,ces mises à jour se font elles obligatoirement dans les agences de domiciliation de nos comptes,agence,positif
page_NSIA,Tout Sauf La Honte,2025-07-10,je suis plus que découragé de nsia banque côte d ivoire un débit à tord dans votre guichet automatique depuis le 8 mai une réclamation déposé depuis le 9 mai mais jusqu à présent mon argent n a pas été donné,guichet,negatif
page_NSIA,Etienne Sede Byy,2025-07-10,nsia banque agence daloa je vous prie de bien vouloir transférer ma carte bancaire à l agence de soubre où je réside à présent j ai fait la demande il y a déjà un mois et une semaine je suis by etienne,agence,positif
page_NSIA,Etienne Sede Byy,2025-07-10,nsia banque agence daloa je vous prie de bien vouloir transférer ma carte bancaire à l agence de soubre où je réside à présent j ai fait la demande il y a déjà un mois et une semaine je suis by etienne,carte,positif
page_NSIA,Jiraya Beaufort,2025-07-10,votre affaire de carte magnétique qui coute 15 000 c est trop hein diminuer,carte,negatif
page_NSIA,Abah Bakary Diarra,2025-07-10,nous souhaitons porter à votre attention certaines préoccupations relatives à l utilisation des cartes magnétiques émises par nsia banque,carte,positif
page_NSIA,Pénya Koné,2025-07-24,j aimerais faire un hors sujet l application n sia banque est faite pour nous aider ou juste pour retrancher quelques chose de nos gain mensuel,application,negatif
page_NSIA,Euphrasias Gloire,2025-07-10,bcq de clients,service client,negatif
page_NSIA,Abah Bakary Diarra,2025-07-03,une banque dont les guichets automatiques ne fonctionnent pas pendant les fins du mois,guichet,negatif
page_NSIA,Abdoul Bamba,2025-07-03,a quand vous allez introduire l application wave sur votre plateforme,application,positif
page_NSIA,Nanourou Siaka Kone,2025-07-03,bonne application merci,application,positif
page_NSIA,Meyan Aristide,2025-07-03,votre application à code compliqué,application,negatif
page_NSIA,Paul Konan,2025-07-03,lorsqu on veut effectuer un virement à travers l application ça ne marche pas ils n envoient pas le code de validation c est dû à quoi,application,negatif
page_NSIA,Paul Konan,2025-07-03,lorsqu on veut effectuer un virement à travers l application ça ne marche pas ils n envoient pas le code de validation c est dû à quoi,virement,negatif
page_NSIA,Aka Aka,2025-07-03,nsia banque côte d ivoire ce que veulent vos clients c est de pouvoir faire des opérations via wave côte d ivoire vos clients éviteront ces rangs aux caisses car vos guichets automatiques ne fonctionnent pas la plupart du temps simplifiez nous la vie,service client,positif
page_NSIA,Aka Aka,2025-07-03,nsia banque côte d ivoire ce que veulent vos clients c est de pouvoir faire des opérations via wave côte d ivoire vos clients éviteront ces rangs aux caisses car vos guichets automatiques ne fonctionnent pas la plupart du temps simplifiez nous la vie,guichet,positif
page_NSIA,Ya Donfryck,2025-07-10,nsia banque côte d ivoire pouvez m aider à me reconnecter à mon application nsia banque direct,application,positif
page_NSIA,Diakaridia Yagabe Coulibaly,2025-07-10,4 fois que je suis allé faire mon application et ils ont toujours refusé de le faire nsia yop zi revoyez votre comportement,application,negatif
page_NSIA,Okêto Elle-même,2025-07-10,un gros flop virement du compte à un autre impossible franchement je déconseille,virement,negatif
page_NSIA,Arsene K. Soro,2025-07-03,c est pendant la période des virements que vous arrêtez vos comptes,virement,negatif
page_NSIA,Adora's Blessing,2025-07-03,bien reçu mais j ai sérieux problème avec le solde de mon compte courant comment faire pour résoudre ce problème demain lundi si la banque se sera indisponible c est aujourd hui voulant faire le retrait que j ai constaté que le solde qui m a été envoyé n est pas ce qui est sur mon compte je vérifie mon solde il y a 100 000 qui manque je n ai pas reçu message non plus de retrait d argent sur mon compte,retrait,negatif
page_NSIA,Haudrey Konan Naelle,2025-07-03,à quel moment vous répondez aux clients aucun de vos numéros ne décroche par mail on en parle pas,service client,negatif
page_NSIA,Bi Toa Raymond Vamé,2025-07-10,et après le premier retrait il faut combien de temps pour le deuxième retrait,retrait,negatif
page_NSIA,Bi Toa Raymond Vamé,2025-07-10,j aimerais savoir les plafond de la carte bancaire saphir nsia,carte,positif
page_NSIA,Stephen Marc Nguessan,2025-06-26,super bienvenue aux clients de bondoukou,service client,positif
page_NSIA,Dedou Anicet,2025-06-26,une seule agence c est pas normal pour cette grande ville nsia banque côte d ivoire,agence,negatif
page_NSIA,Battey Alex Kouassi,2025-06-26,faite le virement on attend ça,virement,negatif
page_NSIA,Clément Gnagnini,2025-06-26,on attend une agence à beoumi,agence,negatif
page_NSIA,Zacharie Gué,2025-07-03,un peu si et si votre gab fonctionne les fins du mois,guichet,negatif
page_NSIA,Kouame Nicaise,2025-06-26,enfin c est pour quand l agence de tanda,agence,negatif
page_NSIA,Marino Kouame,2025-06-26,pour un retrait,retrait,negatif
page_NSIA,Justin Koffi,2025-06-26,ce matin au guichet,guichet,negatif
page_NSIA,Justin Koffi,2025-06-26,pour un retrait l argent n est pas sortie mais j ai été débité,retrait,negatif
page_NSIA,Awoh Florent Yapo,2025-06-26,svp j ai une nouvelle carte saphir je suis le processus mais jusque là le code otp n apparaît pas plus d une heure depuis des jours je vous ai écrit aussi inbox,carte,positif
page_NSIA,F.A services,2025-06-26,félicitations à toutes l équipes nsia banque côte d ivoire pour le service rendu,service client,positif
page_NSIA,Badolo Pima Nicolas,2025-06-26,comment faire pour appeller à l agence nsia d anyama,agence,negatif
page_NSIA,Milanho Lenoir Jean Marc,2025-06-26,bonjour ici svp dites moi si nsia banque a déjà fait le virement de ce mois car je reçois plus de message puis mon application est désactivée urgent,application,positif
page_NSIA,Milanho Lenoir Jean Marc,2025-06-26,bonjour ici svp dites moi si nsia banque a déjà fait le virement de ce mois car je reçois plus de message puis mon application est désactivée urgent,virement,positif
page_NSIA,Alfred Konan,2025-06-26,revoyez votre accueil pour une simple opération on doit passer une journée en agence c,agence,negatif
page_NSIA,Milanho Lenoir Jean Marc,2025-06-26,nsia c est quand les virements de ce mois ci,virement,negatif
page_NSIA,Etienne Sede Byy,2025-06-26,bonjour nsia banque je suis m by etienne mon compte est domicilié à daloa j ai fais une demande de transfert de ma carte bancaire à l agence de soubre où je reside à présent et cela depuis la fin du mois de mai la date d expiration était fin avril je vous prie de bien vouloir répondre à ma sollicitation dans un délai raisonnable excellente semaine à vous,agence,positif
page_NSIA,Etienne Sede Byy,2025-06-26,bonjour nsia banque je suis m by etienne mon compte est domicilié à daloa j ai fais une demande de transfert de ma carte bancaire à l agence de soubre où je reside à présent et cela depuis la fin du mois de mai la date d expiration était fin avril je vous prie de bien vouloir répondre à ma sollicitation dans un délai raisonnable excellente semaine à vous,carte,positif
page_NSIA,Zoumy Kone,2025-06-26,mon compte a été débité sans que je ne pu avoir l argent tout le salaire,virement,negatif
page_NSIA,Samuel Gonzxe Gueu,2025-06-26,une carte qui ne sert pas à grand chose,carte,negatif
page_NSIA,Siaka Sylla Ibn Cheick,2025-07-03,j ai fait ma demande de transfert de carte bancaire depuis le 30 mai et aujourd hui 30 juin pas de trace ni de suite,carte,negatif
page_NSIA,Sylvert Degnan,2025-06-26,moi carte crystal,carte,positif
page_NSIA,Diakaridia Yagabe Coulibaly,2025-06-26,pourquoi la production de carte n est pas automatique ça fait environ 1 mois j ai reçu le message et me rend en agence la bas on me dit qu il vont m appeler jusqu a ce jour rien encore,agence,negatif
page_NSIA,Diakaridia Yagabe Coulibaly,2025-06-26,pourquoi la production de carte n est pas automatique ça fait environ 1 mois j ai reçu le message et me rend en agence la bas on me dit qu il vont m appeler jusqu a ce jour rien encore,carte,negatif
page_NSIA,Milanho Lenoir Jean Marc,2025-06-19,nsia on a compris mais le mieux serait de faire un don de 5000fr sur le compte de chacun des pères de vos clients la concrétisation c est le plus important,service client,positif
page_NSIA,Aimé Kaman,2025-06-19,merci mais revoyez votre politique de plafonnement de nos cartes magnétiques,carte,negatif
page_NSIA,Vally Sanogo,2025-06-19,pourriez vous m envoyer une nouvelle carte car ma carte visa,carte,positif
page_NSIA,Marius Ourigbale,2025-06-19,je pense avoir trop patienté à la fin de ce mois ci je n ai pas accès à mon compte appeler le chef d agence nsia duekoué en même temps,agence,negatif
page_NSIA,Nestor Yapo Asso,2025-06-19,pourquoi vous plafonné les retraits au gab pour quelqu un qui se deplace d une ville à une autre il est obligé d attendre le lendemain encore pour faire un autre retrait,retrait,negatif
page_NSIA,Nestor Yapo Asso,2025-06-19,pourquoi vous plafonné les retraits au gab pour quelqu un qui se deplace d une ville à une autre il est obligé d attendre le lendemain encore pour faire un autre retrait,guichet,negatif
page_NSIA,Nestor Yapo Asso,2025-06-19,a quoi sert la carte magnetique alors,carte,negatif
page_NSIA,Marius Ourigbale,2025-06-19,nsia banque pourquoi créez vous un autre compte courant sans l avis du client cela fait maintenant un an que je ne peux pas avoir accès à mon propre compte t sans l svis du client cela fait maintenant un an que je ne peux pas avoir acces a mon propre compte,service client,negatif
page_NSIA,Samba Cissé,2025-06-19,depuis j ai fait la résiliation de mon assurance épargne plus le délais de traitement,assurance,negatif
page_NSIA,Samba Cissé,2025-06-19,arrivée à un moment ça devient gênant tout ça sans compter les longues attentes dans vos agences lorsqu on y va pour des problèmes,agence,negatif
page_NSIA,Jean De Dieu Kokola,2025-06-19,tu as un soucis tu vas appeller le gestionnaire mais il ne vajamais décrocher,gestionnaire,negatif
page_NSIA,Sahi Dion,2025-07-03,nsia banque revoyez votre agence de divo sinon moi personnellement,agence,negatif
page_NSIA,BarosLeîï Koné,2025-06-19,je vais jamais conseiller nsia banque même a mon pire ennemi,gestionnaire,negatif
page_NSIA,Adou Rachel,2025-06-12,c est quoi la différence entre toutes les couleurs des cartes bancaires nsia,carte,negatif
page_NSIA,Dingui James,2025-06-12,nsia ça fait plus de 6 mois que j attends ma carte d épargne nsia et depuis lors rien y a pas longtemps l agence nsia de daloa m a appelé de venir prendre ma carte ils m ont dit qu ils l ont j ai été stupéfait et c est toujours comme ça en cote d ivoire les gens confondent toujours gagnoa et daloa je ne sais même pas pourquoi alors qu à chaque fois qu ils m appelaient du siège nsia à abidjan je leur répétais toujours que j habitais gagnoa et que je suis là bas en tant que fonctionnaire sincèrement il faut que vos agents soient sérieux dans leur façon de travailler j ai même entamé la procédure de résiliation de cette carte parceque je n en veux plus,agence,negatif
page_NSIA,Dingui James,2025-06-12,nsia ça fait plus de 6 mois que j attends ma carte d épargne nsia et depuis lors rien y a pas longtemps l agence nsia de daloa m a appelé de venir prendre ma carte ils m ont dit qu ils l ont j ai été stupéfait et c est toujours comme ça en cote d ivoire les gens confondent toujours gagnoa et daloa je ne sais même pas pourquoi alors qu à chaque fois qu ils m appelaient du siège nsia à abidjan je leur répétais toujours que j habitais gagnoa et que je suis là bas en tant que fonctionnaire sincèrement il faut que vos agents soient sérieux dans leur façon de travailler j ai même entamé la procédure de résiliation de cette carte parceque je n en veux plus,carte,negatif
page_NSIA,Arnaud Traore,2025-06-12,j ai fait retrait depuis le 31 mai 2025 l argent n ai pas sortie j ai fait une réclamation depuis rien votre affaire là vraiment vous découragé trop les gens on peut même pas conseillé quelqu un à rejoindre cette banque,retrait,negatif
page_NSIA,Guy Serge Brabé,2025-06-12,pourquoi des prélèvements se font sur nos comptes sans faire de retrait chaque mois je suis obligé de faire des réclamations svp respecter vos clients,service client,negatif
page_NSIA,Guy Serge Brabé,2025-06-12,pourquoi des prélèvements se font sur nos comptes sans faire de retrait chaque mois je suis obligé de faire des réclamations svp respecter vos clients,frais,negatif
page_NSIA,Guy Serge Brabé,2025-06-12,pourquoi des prélèvements se font sur nos comptes sans faire de retrait chaque mois je suis obligé de faire des réclamations svp respecter vos clients,retrait,negatif
page_NSIA,Koffi Hippolyte Kouadjo,2025-06-05,pour un prêt vous nantissez non seulement les contrats d assurance pire,assurance,negatif
page_NSIA,Koffi Hippolyte Kouadjo,2025-06-05,vous ne permettez même pas qu on fasse un retrait sur notre pec vraiment de toutes façons j ai déjà pris mes dispositions pour voir ailleurs,retrait,negatif
page_NSIA,Elpyrus Hervé,2025-06-05,j aimerais savoir si ya personne qui travaille là bas parce que celle qui est là bas ne travaille pas tu ne peux pas manquer de respect au autres agence qui vont passer 1 semaines à appeler sans avoir quelqu un derrière pour répondre c est du n importe quoi,agence,negatif
page_NSIA,Paule Atta,2025-06-05,bonjour j ai besoin d un retour de votre srvice client chat,service client,positif
page_NSIA,Brice,2025-06-05,ou t es pas épargné des prélèvements a gogo là lol pas sérieux,frais,negatif
page_NSIA,Diarra Ibrahim,2025-06-05,nsia banque côte d ivoire jai toujours pas reçu de numéro pour la demande de carte,carte,negatif
page_NSIA,Kabongo Didi,2025-06-05,aujourd hui est le 30 mai toutes les banques ont fait les virements qu es ce que vous attendez,virement,positif
page_NSIA,Kabongo Didi,2025-06-05,mais faites le virement des gens vous aviez quelle problème,virement,negatif
page_NSIA,Niamen Jc Andea,2025-06-05,alimentez votre guichet de man,guichet,positif
page_NSIA,Niamen Jc Andea,2025-06-05,vous êtes fort dans virement vite mais vos guichets sont toujours vides tout le reste bien mais alimentez vos guichets surtout celui de man,virement,negatif
page_NSIA,Niamen Jc Andea,2025-06-05,vous êtes fort dans virement vite mais vos guichets sont toujours vides tout le reste bien mais alimentez vos guichets surtout celui de man,guichet,negatif
page_NSIA,Serge Yoboué,2025-06-05,avec ça même gadget vous ne donnez pas à vos clients pour leur souhaiter une meilleure année,service client,negatif
page_NSIA,Daouda Coulibaly,2025-05-29,et puis on a qu à fait quoi avec ça faites virements des gens vous mettez la réflexion,virement,negatif
page_NSIA,Elpyrus Hervé,2025-06-05,nsia vous décevez les clients de jour en jour dans 3 mois je lance la fermeture de mon compte c est du n importe quoi ces gestionnaire qui sont jamais disponible,service client,negatif
page_NSIA,Elpyrus Hervé,2025-06-05,nsia vous décevez les clients de jour en jour dans 3 mois je lance la fermeture de mon compte c est du n importe quoi ces gestionnaire qui sont jamais disponible,gestionnaire,negatif
page_NSIA,Battey Alex Kouassi,2025-05-29,faite le virement on attend ça,virement,negatif
page_NSIA,Elie Niamke,2025-05-29,faite le virement pour payer vos loyers on attend aussi,virement,negatif
page_NSIA,Excellent Garçon,2025-05-29,votre affaire de virement le 24 seulement vous êtes les meilleurs,virement,negatif
page_NSIA,INFOS Concours .CI.,2025-06-05,svp je voudrais savoir la procédure pour emprunter de l argent chez nsia,prêt,negatif
page_NSIA,Jasmin Gossan,2025-05-29,pourtant les virements n,virement,negatif
page_NSIA,Adama Kolotchôlôman Ouattara,2025-05-29,pourquoi avez vous plafonné les retrait au gab à 200 000f par semaine,retrait,negatif
page_NSIA,Adama Kolotchôlôman Ouattara,2025-05-29,pourquoi avez vous plafonné les retrait au gab à 200 000f par semaine,guichet,negatif
page_NSIA,Arsene Dit Becoli,2025-05-29,attendez virement là c est comment,virement,negatif
page_NSIA,Joed Dona Robine,2025-05-29,il n y a plus d agence à faya,agence,negatif
page_NSIA,Niamen Jc Andea,2025-06-05,vos guichets à man,guichet,negatif
page_NSIA,Nalourgo Adama Soro,2025-05-29,les gab refusent les cartes nsia banque côte d ivoire à issia,guichet,negatif
page_NSIA,Nalourgo Adama Soro,2025-05-29,les gab refusent les cartes nsia banque côte d ivoire à issia,carte,negatif
page_NSIA,Kouame Nicaise,2025-05-29,il faut informer aussi votre clientèle que vous êtes en panne de liquidité on ne peut même pas un retrait de plus de 200 mille dans vos guichets automatiques,service client,negatif
page_NSIA,Kouame Nicaise,2025-05-29,il faut informer aussi votre clientèle que vous êtes en panne de liquidité on ne peut même pas un retrait de plus de 200 mille dans vos guichets automatiques,retrait,negatif
page_NSIA,Kouame Nicaise,2025-05-29,il faut informer aussi votre clientèle que vous êtes en panne de liquidité on ne peut même pas un retrait de plus de 200 mille dans vos guichets automatiques,guichet,negatif
page_NSIA,Louis Pierre Blommin,2025-05-29,avec vos guichets automatiques qui ne marchent jamais là puff,guichet,negatif
page_NSIA,Brou Georges N'dri,2025-06-12,la nsia banque l une des plus vieilles en côte d ivoire qui ma foi est une bonne banque en matière de relation clients agent est en train tenir son image lorsque le client demande à quitter la banque il rencontre des problèmes la banque sinon les gestionnaires et leur chef d agence refusent de donner certains papiers non redevance et clôture cela empêche de finaliser les choses dans la nouvelle banque que cela cesse chacun est libre d aller où il veut ce qui est étonnant c est que ces l agence située au siège qui fatigué les clients surtout un gestionnaire du nom de kouassi qui est arrogant et impoli il faut que ça change,service client,positif
page_NSIA,Brou Georges N'dri,2025-06-12,la nsia banque l une des plus vieilles en côte d ivoire qui ma foi est une bonne banque en matière de relation clients agent est en train tenir son image lorsque le client demande à quitter la banque il rencontre des problèmes la banque sinon les gestionnaires et leur chef d agence refusent de donner certains papiers non redevance et clôture cela empêche de finaliser les choses dans la nouvelle banque que cela cesse chacun est libre d aller où il veut ce qui est étonnant c est que ces l agence située au siège qui fatigué les clients surtout un gestionnaire du nom de kouassi qui est arrogant et impoli il faut que ça change,gestionnaire,positif
page_NSIA,Brou Georges N'dri,2025-06-12,la nsia banque l une des plus vieilles en côte d ivoire qui ma foi est une bonne banque en matière de relation clients agent est en train tenir son image lorsque le client demande à quitter la banque il rencontre des problèmes la banque sinon les gestionnaires et leur chef d agence refusent de donner certains papiers non redevance et clôture cela empêche de finaliser les choses dans la nouvelle banque que cela cesse chacun est libre d aller où il veut ce qui est étonnant c est que ces l agence située au siège qui fatigué les clients surtout un gestionnaire du nom de kouassi qui est arrogant et impoli il faut que ça change,agence,positif
page_NSIA,Dosso Namory,2025-05-29,un jour férié les banques sont fermés ok mais les gab doivent fonctionner mais nsia korhogo jamais l argent au gab à chaque virement depuis ce matin impossible de faire un retrait au gab pourquoi et en plus impossible de faire des retraits déplacés dans d autres banques,virement,negatif
page_NSIA,Dosso Namory,2025-05-29,un jour férié les banques sont fermés ok mais les gab doivent fonctionner mais nsia korhogo jamais l argent au gab à chaque virement depuis ce matin impossible de faire un retrait au gab pourquoi et en plus impossible de faire des retraits déplacés dans d autres banques,retrait,negatif
page_NSIA,Dosso Namory,2025-05-29,un jour férié les banques sont fermés ok mais les gab doivent fonctionner mais nsia korhogo jamais l argent au gab à chaque virement depuis ce matin impossible de faire un retrait au gab pourquoi et en plus impossible de faire des retraits déplacés dans d autres banques,guichet,negatif
