source,auteur,date,phrase,aspect,sentiment
page_sgci,Yassoungo Junior Bamba,2024-12-20,à la sgbci précisément à l agence de bouaflé du directeur jusqu à notre gestionnaire aujourd hui sans rendez vous j ai pu bénéficier d un prêt pour pouvoir hospitaliser ma fille d urgence à l hôpital que je suis actuellement et même si le prêt est à débiter sur mon prochain virement mais vraiment ils m ont aidé grâce à dieu mais grâce à sgbci bouaflé la vie de ma fille est épargnée vraiment merci à vous,virement,positif
page_sgci,Yassoungo Junior Bamba,2024-12-20,à la sgbci précisément à l agence de bouaflé du directeur jusqu à notre gestionnaire aujourd hui sans rendez vous j ai pu bénéficier d un prêt pour pouvoir hospitaliser ma fille d urgence à l hôpital que je suis actuellement et même si le prêt est à débiter sur mon prochain virement mais vraiment ils m ont aidé grâce à dieu mais grâce à sgbci bouaflé la vie de ma fille est épargnée vraiment merci à vous,agence,positif
page_sgci,Guessan Kouakou,2024-12-20,vous ne répondez jamais aux préoccupations de vos clients parce que vous vous croyez supérieures aux autres banques,service client,negatif
page_sgci,Emeline Chalvi Guié,2024-12-20,la gestionnaire je suis allée vous voir à une période où il n y a pas d affluence et vous avez refusé de me recevoir pas de problème je sais que vous allez m appeler et nous deux nous savons à quel moment vous allez le faire je promets de vous donner une seule phrase vous allez être fière de votre cliente,service client,negatif
page_sgci,Emeline Chalvi Guié,2024-12-20,la gestionnaire je suis allée vous voir à une période où il n y a pas d affluence et vous avez refusé de me recevoir pas de problème je sais que vous allez m appeler et nous deux nous savons à quel moment vous allez le faire je promets de vous donner une seule phrase vous allez être fière de votre cliente,gestionnaire,negatif
page_sgci,Marouane Fofana de Sualla,2024-12-20,changez aussi lorsque les demandes de cartes sont faites à partir d une agence x faites l effort de nous envoyer dans cette agence ne nous obligez pas à aller forcément dans l agence qui loge nos comptes pour le retrait,agence,positif
page_sgci,Marouane Fofana de Sualla,2024-12-20,changez aussi lorsque les demandes de cartes sont faites à partir d une agence x faites l effort de nous envoyer dans cette agence ne nous obligez pas à aller forcément dans l agence qui loge nos comptes pour le retrait,retrait,positif
page_sgci,Marouane Fofana de Sualla,2024-12-20,changez aussi lorsque les demandes de cartes sont faites à partir d une agence x faites l effort de nous envoyer dans cette agence ne nous obligez pas à aller forcément dans l agence qui loge nos comptes pour le retrait,carte,positif
page_sgci,Amara Diakite,2024-12-20,je comprends pas pourquoi mon ancien gestionnaire ne veut pas me donner ma clôture de compte,gestionnaire,negatif
page_sgci,Atta,2024-12-13,je viens de constater que mon gestionnaire n a pas introduit mon dossier de prêt deposer depuis plus d un mois,gestionnaire,negatif
page_sgci,Victorine Laure M'bé,2024-12-13,jai effectué un retrait dans une autre banque parceque vos distributeur de angre nouveau chu ne fonctionnent jamais il nya jamais assez dargent j ai été débité à tord j ai effectué une réclamation le samedi 09 novembre qui a été enregistré le mardi 12 d ailleurs quand j appelle aujourd hui vos agents ils me demandent de patienter les 30 jours ouvrés,retrait,negatif
page_sgci,Bini Kouassi Albert,2024-12-13,réduisez vos agios,frais,positif
page_sgci,Grace Aimée N'guessan,2024-12-13,société générale côte d ivoire la plus nulle des banques votre service assistance ne répond jamais,service client,negatif
page_sgci,Dosso Noudjou,2024-12-13,bonjour vous nous avez fait faire une mise à jour de sg connect et on a perdu tous nos bénéficiaires enregistrés,application,negatif
page_sgci,Karim Dongo,2024-12-13,cela fait deux ans qu on me facture des frais sans justification à la sgci du grand marché de koumassi,frais,negatif
page_sgci,Reine Ouellé,2024-12-13,depuis hier les guichets cocody centre vallon ne marchent pas vous ne communiquez pas c est quoi tout ça,guichet,negatif
page_sgci,Barakissa Kouame,2024-12-13,demandez à vos personnels du grand marché de koumassi d être franc avec les clients,service client,positif
page_sgci,Letticia Grace Oula,2024-12-13,j ai initié un retrait sans carte et je n ai pas reçu le code temporaire,retrait,negatif
page_sgci,Letticia Grace Oula,2024-12-13,j ai initié un retrait sans carte et je n ai pas reçu le code temporaire,carte,negatif
page_sgci,Atta,2024-12-13,j ai fait ma demande de prêt depuis l âgence de gagnoa et jusqu à ce jour rien donc souvent dites nous clairement la vérité,agence,negatif
page_sgci,Vami Bi Tuei,2024-12-27,je suis client de l agence indenié où je peux retirer ma carte magnétique puisqu elle est en travaux,service client,negatif
page_sgci,Vami Bi Tuei,2024-12-27,je suis client de l agence indenié où je peux retirer ma carte magnétique puisqu elle est en travaux,agence,negatif
page_sgci,Vami Bi Tuei,2024-12-27,je suis client de l agence indenié où je peux retirer ma carte magnétique puisqu elle est en travaux,carte,negatif
page_sgci,Casimir Ouyabe,2024-12-27,depuis deux ans novembre 2022 j ai été débité d un montant d environ 1 000 000f cfa après des erreurs de transactions au gab d une banque confrère toutes mes démarches sont restées sans suite alors que la banque confrère attendait la réclamation de la sgci,guichet,negatif
page_sgci,Jean Serge Kalou,2024-12-27,et comment faire pour avoir ce pret suis client sgbci domicilie à l agence marine treichville et fonctionnaire j ai un pret scolaire dé 18 mois qui finit en janvier 2025 merci dé mè repondre,service client,positif
page_sgci,Jean Serge Kalou,2024-12-27,et comment faire pour avoir ce pret suis client sgbci domicilie à l agence marine treichville et fonctionnaire j ai un pret scolaire dé 18 mois qui finit en janvier 2025 merci dé mè repondre,agence,positif
page_sgci,Yassoungo Junior Bamba,2024-12-13,on a pas été prélevé et le service est indisponible,service client,negatif
page_sgci,Epp Kouyatouo II,2024-12-27,j ai retiré ma carte magnétique a l agence,agence,negatif
page_sgci,Epp Kouyatouo II,2024-12-27,j ai retiré ma carte magnétique a l agence,carte,negatif
page_sgci,Djebri Aboua Noel,2024-12-27,je n ai plus accès à mon appli sg connect que faire,application,negatif
page_sgci,Hussen Le Bon,2024-12-13,quels sont les montants que vous proposez aux clients,service client,negatif
page_sgci,Willy Anderson,2025-01-03,encore je préfère économiser pour réaliser ce que je veux je ne suis en compétition avec personne une souffrance très très silencieuse ko vous avez un bon salaire,virement,negatif
page_sgci,Abdoul Aziz Gnali,2024-12-06,société générale côte d ivoire concernant l interopérabilité les transactions avec les mobiles money où en sommes nous,application,negatif
page_sgci,Musa Abdoulaye Cheick,2024-12-13,le jour je croise le boss sgci beaucoup d agence et nombreux agents vont perdre leur travail,agence,negatif
page_sgci,Ettien Ehouman,2024-12-06,ns avions bessoin d un depot de quichet automatique à arrah ville car les fonctionnaires souffrent leur rétrait,retrait,negatif
page_sgci,Hamilton Gnangby,2024-12-06,l expérience et l expertise au service de,service client,positif
page_sgci,Achille Marie,2024-11-29,mon application connect ne fonctionne pas depuis plusieurs mois et j aimerais une assistance,application,negatif
page_sgci,Safi Oué,2024-11-29,nous on attend virement deh sérieux,virement,positif
page_sgci,Nicole Natacha N'gatta,2024-11-29,même vous allez faire je vais chaanger de banque depuis trois mois je suis derriière mon gestionnaire il dit je dois recevoir code pour l application et après je vais changer depuis je reçois riien j ai appelé le numéro que vous m avez donné ici dix fois maintenant toujours riien j ai acheté nouveau téléphone pour ça rien votre histoire la decouraage moi je vais chaanger de banque mm,application,negatif
page_sgci,Nicole Natacha N'gatta,2024-11-29,même vous allez faire je vais chaanger de banque depuis trois mois je suis derriière mon gestionnaire il dit je dois recevoir code pour l application et après je vais changer depuis je reçois riien j ai appelé le numéro que vous m avez donné ici dix fois maintenant toujours riien j ai acheté nouveau téléphone pour ça rien votre histoire la decouraage moi je vais chaanger de banque mm,gestionnaire,negatif
page_sgci,Aimé Lafrance Irié,2024-11-29,il déconnecté il bloqué les honnête travailleurs avec des applications de merdes,application,negatif
page_sgci,Aimé Lafrance Irié,2024-11-29,es fais si vos services sont incompétent changer les les désagréable que vous occasionné,service client,negatif
page_sgci,Franck Alain Gbi,2024-11-29,le réseau n est pas stable au niveau des virements sgci connect,virement,negatif
page_sgci,Aimé Lafrance Irié,2024-11-29,je suis vraiment déçu de votre nouvelle fonction des retrait sans carte,retrait,negatif
page_sgci,Aimé Lafrance Irié,2024-11-29,je suis vraiment déçu de votre nouvelle fonction des retrait sans carte,carte,negatif
page_sgci,Desire Komelan,2024-11-29,votre produit retrait sans carte est un véritable désastre si vous n avez pas le réseau pour ces opérations ne les proposez pas aux clients,service client,negatif
page_sgci,Desire Komelan,2024-11-29,votre produit retrait sans carte est un véritable désastre si vous n avez pas le réseau pour ces opérations ne les proposez pas aux clients,retrait,negatif
page_sgci,Desire Komelan,2024-11-29,votre produit retrait sans carte est un véritable désastre si vous n avez pas le réseau pour ces opérations ne les proposez pas aux clients,carte,negatif
page_sgci,Jacques Fidel Niamke,2024-12-06,bonjour svp qui connait l agence du parc de la socgen la localisation svp,agence,positif
page_sgci,Trazie Habib Zoro Bi,2024-11-29,votre application ne passe jamais,application,negatif
page_sgci,Olivier Brou-bi,2024-11-29,avoir un compte bancaire chez vous cette comme aller au champs et chercher sa marchette sous l apatam le sempa nous impose des banques qui ne sont pas professionnelle comment avoir un compte en banque sans carte au xxièm siècle où la technologie à évoluer,carte,negatif
page_sgci,Yedess Hermann,2024-11-29,mon remboursement de mon prêt depuis plus de 1 mois j appelle je vais a l agence rien j appelle on me faire savoir qu on va m aider mais je contacte rien j ai besoin d aide nous sommes en fin d année je veux rembourser mon prêt,agence,negatif
page_sgci,Société Générale Côte d’Ivoire,2024-11-29,hermann nous sommes vraiment désolés du désagrément envoyez nous vos réclamations sur par mail à l adresse satisfaction clients socgen com ou cliquez sur bit ly ereclamation,service client,positif
page_sgci,Yedess Hermann,2024-12-06,société générale côte d ivoire le mail satisfaction clients socgen com je n arrive pas envoyé de message sa sort introuvable,service client,negatif
page_sgci,Baguiba Zohi Brigitte,2024-11-22,j ai déposé ma demande de non redevance et de clôture de compte depuis deux semaines à l agence de daloa pas de suite pourquoi,agence,negatif
page_sgci,Ma Gnou,2024-11-15,les retraits sans cartes sont indisponibles,retrait,negatif
page_sgci,Ma Gnou,2024-11-15,les retraits sans cartes sont indisponibles,carte,negatif
page_sgci,Yao Faustin Kouadio,2024-11-15,nous rembourser les prélèvements fait sur nos comptes pourraient un temps soit peu nous apporter aussi la paix,frais,negatif
page_sgci,Dan Singault,2024-11-15,une proposition sg connect est assez connue et utilisée par plusieurs de vos clients il pourrait encore plus leur faciliter les choses dans leurs rapports avec vous créez des mécanismes pour permettre de souscrire ou de résilier des credimatic pel ou d autres produits par ce canal le client pourrait signer les documents et les renvoyer avec des garantis de sécurité puisqu on installe déjà sg connect en ligne cela éviterait des déplacements coûteux et fatiguants pour des choses si simples c est juste une proposition encore merci pour vos services,service client,positif
page_sgci,Dan Singault,2024-11-15,une proposition sg connect est assez connue et utilisée par plusieurs de vos clients il pourrait encore plus leur faciliter les choses dans leurs rapports avec vous créez des mécanismes pour permettre de souscrire ou de résilier des credimatic pel ou d autres produits par ce canal le client pourrait signer les documents et les renvoyer avec des garantis de sécurité puisqu on installe déjà sg connect en ligne cela éviterait des déplacements coûteux et fatiguants pour des choses si simples c est juste une proposition encore merci pour vos services,application,positif
page_sgci,Jonas Koffi,2024-11-15,faites cadeau des anciens véhicules à vos fidèles clients comme nous je suis domicilié à la générale depuis 2002 soit 22 ans,service client,positif
page_sgci,Société Générale Côte d’Ivoire,2024-11-15,nous sommes vraiment désolés du désagrément nous transmettons vos commentaires aux services expérience client société générale côte d ivoire,service client,negatif
page_sgci,Eric Siaba,2024-11-08,merci bien pour le gab qui a été mis en état de fonctionnement,guichet,positif
page_sgci,Legagnoa Oppoh,2024-11-08,le virement permanent est il payant,virement,negatif
page_sgci,Sinaly Bakayoko,2024-11-08,si le salaire même n arrive pas à couvrir les dépenses ont va épargné quoi,virement,negatif
page_sgci,Djimi Jaurès Kouadio,2024-11-08,la meilleure appli,application,positif
page_sgci,Abdoul Aziz Gnali,2024-11-08,et les virements vers les comptes mobiles,application,negatif
page_sgci,Abdoul Aziz Gnali,2024-11-08,et les virements vers les comptes mobiles,virement,negatif
page_sgci,Kouassi Dangui,2024-11-08,oui ces vraiment meilleur partout mais penser à la sgci de danané un seul guichet une seule caisse pour tout ce monde dans cette ville ces calvaires les fin du mois,guichet,positif
page_sgci,Thierry Fulgence Balecoidjo,2024-11-08,félicitations mais donner crédit a 1 au client car c est deux mains qui se lave,service client,negatif
page_sgci,Desire Komelan,2024-11-29,à quoi sert ce prix un système de retrait sans carte inopérant les fonds des clients malgré l échec des opérations,service client,negatif
page_sgci,Desire Komelan,2024-11-29,à quoi sert ce prix un système de retrait sans carte inopérant les fonds des clients malgré l échec des opérations,retrait,negatif
page_sgci,Desire Komelan,2024-11-29,à quoi sert ce prix un système de retrait sans carte inopérant les fonds des clients malgré l échec des opérations,carte,negatif
page_sgci,Desire Komelan,2024-11-29,restent bloqués dans votre système vos conseillers clients en agence semblent toujours ne pas savoir quoi répondre et semblent toujours surpris et souvent dédaigneux et on vous donne des prix que la complaisance,service client,negatif
page_sgci,Desire Komelan,2024-11-29,restent bloqués dans votre système vos conseillers clients en agence semblent toujours ne pas savoir quoi répondre et semblent toujours surpris et souvent dédaigneux et on vous donne des prix que la complaisance,gestionnaire,negatif
page_sgci,Desire Komelan,2024-11-29,restent bloqués dans votre système vos conseillers clients en agence semblent toujours ne pas savoir quoi répondre et semblent toujours surpris et souvent dédaigneux et on vous donne des prix que la complaisance,agence,negatif
page_sgci,Gustave Kouadio,2024-11-08,la fois dernière le vendredi 25 octobre dernier à l agence de dimbokro nous avons été bloqués pendant toute la famille dommage pour nous qui venons des villages voisins comment y retourner sans sous et surtout avec nos familles,agence,negatif
page_sgci,Boua Kenan Estavez,2024-11-08,pensez à rendre la vie de vos clients moins difficile en leur permettant de faire les retraits avec les mobiles money voilà près de 2 semaine que le seul guichet sgci pour toute la région de bouna bounkani est hors service,service client,negatif
page_sgci,Boua Kenan Estavez,2024-11-08,pensez à rendre la vie de vos clients moins difficile en leur permettant de faire les retraits avec les mobiles money voilà près de 2 semaine que le seul guichet sgci pour toute la région de bouna bounkani est hors service,application,negatif
page_sgci,Boua Kenan Estavez,2024-11-08,pensez à rendre la vie de vos clients moins difficile en leur permettant de faire les retraits avec les mobiles money voilà près de 2 semaine que le seul guichet sgci pour toute la région de bouna bounkani est hors service,retrait,negatif
page_sgci,Boua Kenan Estavez,2024-11-08,pensez à rendre la vie de vos clients moins difficile en leur permettant de faire les retraits avec les mobiles money voilà près de 2 semaine que le seul guichet sgci pour toute la région de bouna bounkani est hors service,guichet,negatif
page_sgci,Hamed Faman Sidibé,2024-11-08,pardonner veuillez régler le problème de guichet automatique de dabakala toujours hors service,service client,negatif
page_sgci,Hamed Faman Sidibé,2024-11-08,pardonner veuillez régler le problème de guichet automatique de dabakala toujours hors service,guichet,negatif
page_sgci,Emmanuel Grâce,2024-11-01,svp comment lier son compte à l application,application,positif
page_sgci,Eric Gnazergbo,2024-11-01,j espère que les virements sont faits hein,virement,negatif
page_sgci,Jean Guillaume Kadjo,2024-11-08,les clients,service client,negatif
page_sgci,Jean Guillaume Kadjo,2024-11-08,et si on faisait une coalition pour déserter la banque vu qu elle ne semble prendre en considération notre souhait de voir nos comptes associés aux réseaux mobile money,application,negatif
page_sgci,Hamed Faman Sidibé,2024-11-08,pardonner veuillez régler le problème de guichet automatique de dabakala toujours hors service on souffre trop,service client,negatif
page_sgci,Hamed Faman Sidibé,2024-11-08,pardonner veuillez régler le problème de guichet automatique de dabakala toujours hors service on souffre trop,guichet,negatif
page_sgci,Mathieu Kouame,2024-11-08,mais depuis plus de 2 jours ya un souci dans les guichets automatiques pour les retraits,retrait,negatif
page_sgci,Mathieu Kouame,2024-11-08,mais depuis plus de 2 jours ya un souci dans les guichets automatiques pour les retraits,guichet,negatif
page_sgci,Yetii Yeo,2024-11-08,depuis hier aucun guichet de la générale ne fonctionne même quand tu vas avec ta cartes dans une autres banque on rejette,guichet,negatif
page_sgci,Yetii Yeo,2024-11-08,depuis hier aucun guichet de la générale ne fonctionne même quand tu vas avec ta cartes dans une autres banque on rejette,carte,negatif
page_sgci,Armand Koffi,2024-11-01,et si je fermais mon compte a société générale côte d ivoire après des années l agio reste inchangé,frais,negatif
page_sgci,Yao Faustin Kouadio,2024-11-01,juste un rappel les prélèvements abusifs effectués sur nos comptes n oubliez pas de nous les reverser merci,frais,positif
page_sgci,Soumaila Siahoue,2024-11-01,société générale côte d ivoire vous me prélevé deux fois 7000fr chaque mois d octobre pour une assurance yanconfort que j ai jamais souscris depuis 2018 j ai fais réclamation mais rien rembourser mon argent,assurance,negatif
page_sgci,Daoudy Arobase,2024-11-01,pour ma part je veux qu il respecte les rendez vous vous appelez les gens pour prendre rendez vous et arriver là bas vous dit que les gestionnaires ne sont pas disponibles,gestionnaire,negatif
page_sgci,Marius Aboh,2024-11-01,en quoi faire des achats à la librairie de france avec la carte visa permet il de faire des économies depuis quand une banquearrange t elle des gens,carte,negatif
page_sgci,Marius Aboh,2024-11-01,j aimerais aussi que vous formiez bien vos conseils clients ils ne prennent jamais les appels lorsque vous avez des problèmes si c est pour vous proposer de prendre des prêts là ils connaissent votre numéro,service client,positif
page_sgci,Nahounou Guy Patrick Logbo,2024-11-01,vous nous expliquer ces sommes énormes que vous avez débité à vos clients ce mois,service client,negatif
page_sgci,Vami Serge-auguste Yao,2024-11-01,quel est le souci avec l application sgci connect s il vous plaît,application,positif
page_sgci,Abdoullah Muminune Traore,2024-11-01,une banque où les gestionnaires ne répondent jamais aux appels ni messages lorsque les clients ont des soucis,service client,negatif
page_sgci,Abdoullah Muminune Traore,2024-11-01,une banque où les gestionnaires ne répondent jamais aux appels ni messages lorsque les clients ont des soucis,gestionnaire,negatif
page_sgci,Benzema Karim,2024-10-25,bon vous je sais pas vous avez quel problème toutes les banques ont fait le virement sauf vous et vous raconter des bêtises sais bien continuer incha allah un seul jour j irai à la bdu vous laissez,virement,negatif
page_sgci,Nicole Natacha N'gatta,2024-11-08,je ne reçois pas de mot de passe depuis j ai appelé le numéro que vous m avez donné 5fois ils m ont dit de réinitialiser mon téléphone je l ai fait de désinstaller des applications je l ai fait mais toujours pareil,application,negatif
page_sgci,Abdoul Aziz Gnali,2024-10-25,société générale côte d ivoire on attend toujours la liaison de nos comptes courants à nos comptes mobiles money hein vous avez dit bientôt mais toujours rien,application,negatif
page_sgci,Boris Anderson Aka,2024-10-25,les retraits sans carte sont indisponibles aujourd hui,retrait,negatif
page_sgci,Boris Anderson Aka,2024-10-25,les retraits sans carte sont indisponibles aujourd hui,carte,negatif
page_sgci,Benzema Karim,2024-10-25,chrr faites nos virements homme,virement,positif
page_sgci,Bialle Bethsaleel Lebéni,2024-10-25,je suis dans une autre banque et je veux que mon salaire soit viré à la générale,virement,negatif
page_sgci,Hamed Tidiane Traore,2024-10-25,le mois passé mon agios a augmenté svp donnez moi les raisons de cette augmentation,frais,negatif
page_sgci,Alexis Kouame,2024-10-25,à quand les transactions les mobiles money et les comptes bancaires,application,positif
page_sgci,Mamadou Coulibaly,2024-10-25,mais es ce que les virements sont disponibles,virement,positif
page_sgci,Jean-Claude Domaih,2024-10-25,votre affaire de retrait sans carte moi je essaye à plusieurs reprises et ça ne marche pas,retrait,negatif
page_sgci,Jean-Claude Domaih,2024-10-25,votre affaire de retrait sans carte moi je essaye à plusieurs reprises et ça ne marche pas,carte,negatif
page_sgci,Eric Siaba,2024-10-25,le guichet automatique de bangolo toujours hors service depuis 4 semaines,service client,negatif
page_sgci,Eric Siaba,2024-10-25,le guichet automatique de bangolo toujours hors service depuis 4 semaines,guichet,negatif
page_sgci,Issiaka Tiekoura Bah,2024-10-25,virement est passé,virement,negatif
page_sgci,Nath Goré Lou,2024-10-25,votre guichet automatique de bangolo est toujours indisponible depuis plus d un mois,guichet,negatif
page_sgci,Kero-kero Kevin,2024-10-25,à quand la combinaison avec les comptes mobile money,application,negatif
page_sgci,Romeo Yao,2024-11-01,mon application sg connect ne passe pas,application,negatif
page_sgci,N'guessan Kouassi Raoul,2024-11-01,il faut obligatoirement la carte magnétique de la sgci pour effectuer ce type de retrait,retrait,negatif
page_sgci,N'guessan Kouassi Raoul,2024-11-01,il faut obligatoirement la carte magnétique de la sgci pour effectuer ce type de retrait,carte,negatif
page_sgci,Bamba Touré,2024-11-01,société générale côte d ivoire svp est il possible de transférer de l argent de mon compte sgci à un compte mobile money,application,positif
page_sgci,Mireille Nguessan,2024-10-25,ces affaires ou virement on paye la on veut pa,virement,negatif
page_sgci,Esther N'cho,2024-11-01,vos gestionnaires,gestionnaire,negatif
page_sgci,Eric Siaba,2024-11-01,merci bien le problème du guichet automatique de bangolo a été enfin résolu,guichet,positif
page_sgci,Jo Assagou,2024-11-01,depuis ce matin je ne fais qu essayer ça ne passe pas de plus même une opération de virement interne ne passe pas pffff,virement,negatif
page_sgci,Henri Daniel,2024-11-08,svp pourquoi retrait sans carte j ai,retrait,negatif
page_sgci,Henri Daniel,2024-11-08,svp pourquoi retrait sans carte j ai,carte,negatif
page_sgci,N'golo Diarrassouba,2024-10-25,société générale côte d ivoire liez les comptes mobiles,application,positif
page_sgci,Ouattara Nomthon Salifou,2024-11-01,est ce que le virement est passé,virement,negatif
page_sgci,Eliyshà Sokoury,2024-10-18,ça fait 10 mois que je cherche ma carte magnétique mais la sgci refuse de me donner,carte,negatif
page_sgci,Doriane Bro,2025-02-21,que ma carte magnétique n est pas de cvv,carte,negatif
page_sgci,Mohamed Coulibaly,2024-10-18,bjr ma carte magnétique expire le mois prochain novembre 2024,carte,positif
page_sgci,Laetitia Emeraude,2024-10-25,mais ce matin l application ne passe pas c,application,negatif
page_sgci,Laetitia Emeraude,2024-10-25,est dû à quoi tout ça carte magnétique pas encore disponible depuis 3mois de déclaration de perte du coups je me retrouve à des retraits sans carte et là encore il y a problème pffff,retrait,negatif
page_sgci,Laetitia Emeraude,2024-10-25,est dû à quoi tout ça carte magnétique pas encore disponible depuis 3mois de déclaration de perte du coups je me retrouve à des retraits sans carte et là encore il y a problème pffff,carte,negatif
