source,auteur,date,phrase,aspect,sentiment
page_sgci,Yele Sarah Coulibaly,2025-05-23,jai l argent sur compte courant impossible de retirer au guichet ki affiche 1700f avec sg connect et selon mes retraits effectué j ai l argent sur mon compte,retrait,positif
page_sgci,Yele Sarah Coulibaly,2025-05-23,jai l argent sur compte courant impossible de retirer au guichet ki affiche 1700f avec sg connect et selon mes retraits effectué j ai l argent sur mon compte,guichet,positif
page_sgci,Clément Gnagnini,2025-05-23,on attend le virement d abord,virement,negatif
page_sgci,Ismael Ramsey,2025-05-23,bonjour ma carte ne passe pas depuis je l ai obtenu,carte,positif
page_sgci,Innocent Kouakou Roland,2025-05-23,une doléance pour la carte visa doit durer 5 ans avant de changer chaque 3 ans est pénible,carte,negatif
page_sgci,Sylvestre Koffi,2025-05-30,on célèbre la fêtes des mères comment si vous n avez pas fait les virements société générale côte d ivoire,virement,negatif
page_sgci,Kacou Assemian Serge Pacome,2025-05-30,voici des gens qui jouent avec l argent des gens vous savez que 25 tombe un dimanche et en plus fête des mères mais vous ne faites pas le virement le 24 c est être méchant vraiment méchant,virement,negatif
page_sgci,Yele Sarah Coulibaly,2025-05-23,vos gestionnaire ne décroche jamais ah yeri meme faut avoir souffle,service client,negatif
page_sgci,Yele Sarah Coulibaly,2025-05-23,vos gestionnaire ne décroche jamais ah yeri meme faut avoir souffle,gestionnaire,negatif
page_sgci,Kacou Assemian Serge Pacome,2025-05-30,je vais chercher à quitter votre banque c est pasque vous avez beaucoup de clients que vous faites sa pendant les autres banques ont fait les virements,service client,negatif
page_sgci,Kacou Assemian Serge Pacome,2025-05-30,je vais chercher à quitter votre banque c est pasque vous avez beaucoup de clients que vous faites sa pendant les autres banques ont fait les virements,virement,negatif
page_sgci,Benie Roger Fulgence Bredou,2025-05-23,il faut diminuer les agios et le taux d intérêt sur les prêts,frais,negatif
page_sgci,Alassane Ouattara Largaton,2025-05-30,les virements du mois de mai c est,virement,negatif
page_sgci,Zouzou Hervé Irresse,2025-05-23,il faut revoir les agios et le taux d intérêt des clients que nous sommes plus de 17ans les mêmes choses pitié,service client,negatif
page_sgci,Zouzou Hervé Irresse,2025-05-23,il faut revoir les agios et le taux d intérêt des clients que nous sommes plus de 17ans les mêmes choses pitié,frais,negatif
page_sgci,Tehoro Tehoro,2025-05-23,il faut proposer aux clients les prêts de gros montants par exemple à partir de 300000f on arrive à prendre un prêt de 10000000,service client,negatif
page_sgci,Konan Darius Kouame,2025-05-30,il faut revoir les agios c est chère société générale côte d ivoire,frais,negatif
page_sgci,Jules Dou Bi,2025-05-23,moi j aime cette banque car ma gestionnaire me propose des prêts dès que je la sollicite sans problème bravo à la nouvelle vision instaurée,gestionnaire,positif
page_sgci,Yele Sarah Coulibaly,2025-05-23,je viens de votre agence le solde disponible est différent du solde au guichet je peux pas retirer mon argent vous exagéré gestionnaire décroche jamais les appels pour moi chauffe pas si jusqu à la fin je n arrive pas à retirer je ferme souuhhaii l argent n aime pas foutaise,gestionnaire,negatif
page_sgci,Yele Sarah Coulibaly,2025-05-23,je viens de votre agence le solde disponible est différent du solde au guichet je peux pas retirer mon argent vous exagéré gestionnaire décroche jamais les appels pour moi chauffe pas si jusqu à la fin je n arrive pas à retirer je ferme souuhhaii l argent n aime pas foutaise,agence,negatif
page_sgci,Yele Sarah Coulibaly,2025-05-23,je viens de votre agence le solde disponible est différent du solde au guichet je peux pas retirer mon argent vous exagéré gestionnaire décroche jamais les appels pour moi chauffe pas si jusqu à la fin je n arrive pas à retirer je ferme souuhhaii l argent n aime pas foutaise,guichet,negatif
page_sgci,Emmanuel Hermann Trah,2025-05-23,je la conseillais à mes cadets mais aujourd hui je suis découragé de votre banque parce que vous avez échoué au transfert de ma carte magnétique qui a duré 6 mois je suis vraiment déçu et je ne suis plus ambassadeur de votre banque auprès de mes nouveaux cadets cordialement,carte,negatif
page_sgci,Negus Otchoumou,2025-05-30,moi je reçois plus de messages concernant les virements alors que je suis facturé chaque mois,virement,negatif
page_sgci,Bill Leymane,2025-05-30,vous changez les gestionnaires sans informer les clients cest un manque respect la nouvelle gestionnaire aussi n a pas pris le soin aussi d appeler,service client,negatif
page_sgci,Bill Leymane,2025-05-30,vous changez les gestionnaires sans informer les clients cest un manque respect la nouvelle gestionnaire aussi n a pas pris le soin aussi d appeler,gestionnaire,negatif
page_sgci,Gbane Ibrahima,2025-05-23,ça presque deux mois que je n arrive pas à faire retrait sous prétexte que je dois faire une mise à jour j ai envoyé un certificat de résidence plus ma carte d identité mais rien,retrait,negatif
page_sgci,Gbane Ibrahima,2025-05-23,ça presque deux mois que je n arrive pas à faire retrait sous prétexte que je dois faire une mise à jour j ai envoyé un certificat de résidence plus ma carte d identité mais rien,carte,negatif
page_sgci,Sié Emmanuel Dah,2025-05-23,pourquoi les virements du compte épargne au compte courant via l application sg connect ne passe plus,application,negatif
page_sgci,Sié Emmanuel Dah,2025-05-23,pourquoi les virements du compte épargne au compte courant via l application sg connect ne passe plus,virement,negatif
page_sgci,Jean De Dieu Toure,2025-05-16,la gestionnaire actuelle de l agence de grand bassam est très arrogante elle n a aucun respect pour ses clients,service client,negatif
page_sgci,Jean De Dieu Toure,2025-05-16,la gestionnaire actuelle de l agence de grand bassam est très arrogante elle n a aucun respect pour ses clients,gestionnaire,negatif
page_sgci,Jean De Dieu Toure,2025-05-16,la gestionnaire actuelle de l agence de grand bassam est très arrogante elle n a aucun respect pour ses clients,agence,negatif
page_sgci,Yele Sarah Coulibaly,2025-05-23,je viens de constater un prélèvement sans trace de 17800f sur mon compte courant franchement vous commencer à me décevoir ça disparu après l argent à réapparu aujourd hui je vais au guichet rien,guichet,negatif
page_sgci,Trazie Habib Zoro Bi,2025-05-16,bonjour cela fait plus d un mois que mon compte est bloqué pour les retraits et transferts malgré plusieurs relances à l agence en tant qu étudiant c est très difficile merci de faire remonter la situation j ai besoin d une solution rapide,agence,positif
page_sgci,Trazie Habib Zoro Bi,2025-05-16,bonjour cela fait plus d un mois que mon compte est bloqué pour les retraits et transferts malgré plusieurs relances à l agence en tant qu étudiant c est très difficile merci de faire remonter la situation j ai besoin d une solution rapide,retrait,positif
page_sgci,Yao Jean Dema Kouadio,2025-05-16,il vous plaît régler le souci avec l application sg connect,application,negatif
page_sgci,Olivier Djiehoua,2025-05-09,je n arrive pas à utiliser l application seulement les virements et la carte marque inactif,application,negatif
page_sgci,Olivier Djiehoua,2025-05-09,je n arrive pas à utiliser l application seulement les virements et la carte marque inactif,virement,negatif
page_sgci,Olivier Djiehoua,2025-05-09,je n arrive pas à utiliser l application seulement les virements et la carte marque inactif,carte,negatif
page_sgci,Henry Koushner,2025-05-09,depuis j ai obtenu crédit avec vous mes virements vous les bloqué et vous les débloqué quand vous voulez c est quoi le souci,virement,negatif
page_sgci,Henry Koushner,2025-05-16,votre souci cette banque qui n a aucun respect pour le client vous bloquez les virements et on vous appels vous coupez les appels mais c est quoi votre probleme,service client,negatif
page_sgci,Henry Koushner,2025-05-16,votre souci cette banque qui n a aucun respect pour le client vous bloquez les virements et on vous appels vous coupez les appels mais c est quoi votre probleme,virement,negatif
page_sgci,Kuame Jean Sebastien Duval,2025-05-09,intégrez à votre application les virements vers les mobiles monnaies depuis plus d un an,application,positif
page_sgci,Kuame Jean Sebastien Duval,2025-05-09,intégrez à votre application les virements vers les mobiles monnaies depuis plus d un an,virement,positif
page_sgci,Malomé Bamba,2025-05-09,est ce que monsieur le directeur de la société générale sait que la sgci a mon salaire du mois d avril 2025 actuellement,virement,negatif
page_sgci,Fofana Marouane Adama,2025-05-09,pourquoi vos gestionnaires qui sont sensés nous venir en aide se foutent des clients,service client,negatif
page_sgci,Fofana Marouane Adama,2025-05-09,pourquoi vos gestionnaires qui sont sensés nous venir en aide se foutent des clients,gestionnaire,negatif
page_sgci,Autorité Clinton,2025-05-02,moi je n ai pas été reversé malgré que le salaire ne passe plus à la sgci,virement,negatif
page_sgci,Traore Iman,2025-05-09,société générale côte d ivoire je n arrive pas à faire de virement et de transfert dab depuis mon sg connect depuis maintenant plusieurs jours,application,negatif
page_sgci,Traore Iman,2025-05-09,société générale côte d ivoire je n arrive pas à faire de virement et de transfert dab depuis mon sg connect depuis maintenant plusieurs jours,virement,negatif
page_sgci,Aimé Lafrance Irié,2025-05-02,vos services de sg connect les virement sans carte sont plafonné aussi,service client,positif
page_sgci,Aimé Lafrance Irié,2025-05-02,vos services de sg connect les virement sans carte sont plafonné aussi,application,positif
page_sgci,Aimé Lafrance Irié,2025-05-02,vos services de sg connect les virement sans carte sont plafonné aussi,virement,positif
page_sgci,Aimé Lafrance Irié,2025-05-02,vos services de sg connect les virement sans carte sont plafonné aussi,carte,positif
page_sgci,Brassard Gnagne,2025-05-02,société générale côte d ivoire je voudrais savoir si c est normal d avoir messalia push et dans le même temps avoir sg connect car je comprends pas cela fait bientôt plus de 02 ans j ai résilié le produit messalia push mais je constate qu on me prélève toujours je comprends pas bref j ai posé plusieurs réclamations pour ce problèmes et rien ok c est juste pour attirer votre attention sinon que le mois de mai je compte ne plus faire partie des clients de la sgci merci car trop c est trop,service client,negatif
page_sgci,Brassard Gnagne,2025-05-02,société générale côte d ivoire je voudrais savoir si c est normal d avoir messalia push et dans le même temps avoir sg connect car je comprends pas cela fait bientôt plus de 02 ans j ai résilié le produit messalia push mais je constate qu on me prélève toujours je comprends pas bref j ai posé plusieurs réclamations pour ce problèmes et rien ok c est juste pour attirer votre attention sinon que le mois de mai je compte ne plus faire partie des clients de la sgci merci car trop c est trop,application,negatif
page_sgci,Lanz Fof,2025-05-02,n avez vous pas de package pour lier son compte bancaire à un mobile money en vue de faciliter la tâche à vos clients,service client,negatif
page_sgci,Lanz Fof,2025-05-02,n avez vous pas de package pour lier son compte bancaire à un mobile money en vue de faciliter la tâche à vos clients,application,negatif
page_sgci,Nouvelle Vie Benie,2025-05-02,je suis vraiment déçue de vous un simple mini relevé on ne peut l avoir j ai fais toutes les agences du plateau riennnn j appelle mon gestionnaire aucun retour kpaaaa,gestionnaire,negatif
page_sgci,Nouvelle Vie Benie,2025-05-02,je suis vraiment déçue de vous un simple mini relevé on ne peut l avoir j ai fais toutes les agences du plateau riennnn j appelle mon gestionnaire aucun retour kpaaaa,agence,negatif
page_sgci,Tite Angoran,2025-05-02,société générale côte d ivoire sg connect n est pas disponible,application,negatif
page_sgci,Olivier Djiehoua,2025-05-02,mon application ne fonctionne pas on me parle de mise a jour depuis un mois mon agence anyama,application,negatif
page_sgci,Olivier Djiehoua,2025-05-02,mon application ne fonctionne pas on me parle de mise a jour depuis un mois mon agence anyama,agence,negatif
page_sgci,Olivier Djiehoua,2025-05-02,aussi ma carte bancaire est inactif,carte,negatif
page_sgci,Diana Ahui,2025-05-02,votre guichet plateau,guichet,negatif
page_sgci,Prevo Kongo,2025-05-02,je ne comprends pas pourquoi tous les fins du mois pour passer au 1er les guichets sont indisponibles c est une situation inconfortable,guichet,negatif
page_sgci,Desire Assielou,2025-05-02,tous les guichets de cocody sont indisponibles aujourd hui faites au moins un message pour nous prévenir ou bien,guichet,negatif
page_sgci,Armel Edja,2025-05-02,vous n accordez aucune importance au problèmes liées au guichets automatiques suites à un retrait sa fait des mois je marche dans vos locaux,agence,negatif
page_sgci,Armel Edja,2025-05-02,vous n accordez aucune importance au problèmes liées au guichets automatiques suites à un retrait sa fait des mois je marche dans vos locaux,retrait,negatif
page_sgci,Armel Edja,2025-05-02,vous n accordez aucune importance au problèmes liées au guichets automatiques suites à un retrait sa fait des mois je marche dans vos locaux,guichet,negatif
page_sgci,Kouadio Jean-yves,2025-05-02,expliquez l assurance yaconfort,assurance,positif
page_sgci,Koffi Jean François Konan,2025-04-25,combien la carte visa,carte,positif
page_sgci,Ismael Ramsey,2025-04-25,ma carte bancaire ne passe pas depuis je l ai obtenu que faire,carte,negatif
page_sgci,Abou Ouattara Seydou,2025-04-25,puis je renouveler ma carte visa par votre canal,carte,positif
page_sgci,Société Générale Côte d’Ivoire,2025-04-25,jean francois niasson c est gratuit pour en savoir plus cliquez sur https particuliers societegenerale ci carte société générale côte d ivoire vous remercie,carte,positif
page_sgci,Yedess Hermann,2025-05-02,je veux entrer en contact avec un gestionnaire pour exposer un problème,gestionnaire,negatif
page_sgci,Diomandé Moussa,2025-04-25,j ai un souci je n arrive pas à me connecter sur sg connect,application,negatif
page_sgci,Idrissa Berte,2025-05-02,je suis allée dans une agence pour installer l aplication sg connect on demande un certificat de résidence,application,negatif
page_sgci,Idrissa Berte,2025-05-02,je suis allée dans une agence pour installer l aplication sg connect on demande un certificat de résidence,agence,negatif
page_sgci,Ismael Ramsey,2025-04-25,ma carte ne passe pas depuis que je l ai obtenu sur faire,carte,negatif
page_sgci,Tchimou Daho Arnaud Meney,2025-04-25,mais on attend depuis le processus de transfert de nos fonds bancaires via les mobiles money en particulier wave côte d ivoire,application,positif
page_sgci,Aka Armel Ervine,2025-07-25,quel est la procédure en cas de perte de carte pour l obtention d une nouvelle,carte,negatif
page_sgci,Henri Michel Ndri,2025-04-25,sg connect c est combien le mois,application,negatif
page_sgci,Brassard Gnagne,2025-04-11,ah oui quand ses vos intérêts vous connaissez les clients par contre pour les besoins et réclamations des clients vous faites la sourde oreille n importe quoi,service client,negatif
page_sgci,Fofana Marouane Adama,2025-04-11,vos gestionnaires,gestionnaire,negatif
page_sgci,Fofana Marouane Adama,2025-04-11,à nos disposition sont pas gentils ils aiment pas répondre aux appels de leurs clients et pire il ne répondre jamais aussi aux sms,service client,negatif
page_sgci,Konan Darius Kouame,2025-04-11,même est bizarre quand tu fais le retrait sans carte magnétique tu paies frais alors qu ils t ont déjà coupé agios c est bizarre quand même,frais,negatif
page_sgci,Konan Darius Kouame,2025-04-11,même est bizarre quand tu fais le retrait sans carte magnétique tu paies frais alors qu ils t ont déjà coupé agios c est bizarre quand même,retrait,negatif
page_sgci,Konan Darius Kouame,2025-04-11,même est bizarre quand tu fais le retrait sans carte magnétique tu paies frais alors qu ils t ont déjà coupé agios c est bizarre quand même,carte,negatif
page_sgci,Pascal Pythagore,2025-04-11,comment suivre son compte sur sg connect c,application,positif
page_sgci,Prunelle de Dieu,2025-04-18,impossible d accès depuis 2 mois le service client,service client,negatif
page_sgci,Stones Gonde,2025-04-11,je n arrive pas à télécharger l application,application,negatif
page_sgci,Santos Assanvo,2025-04-11,pourquoi les gestionnaires ne répondent pas aux appels quand tu arrives sans les prévenir on te dire tu peux etre recu parce que tu n a pas pris rendez vous tu appelles pour prendre rendez vous aussi ils ne prennent pas du moins le miens ne prend pas,gestionnaire,negatif
page_sgci,Appiah Martial N'kesse,2025-04-11,la seule chose qu on vous demande c est l innovation afin de faciliter le quotidien de votre clientèle on en a marre de nous déplacer jusqu à vos guichets automatiques et constater qu ils sont hs surtout à l intérieur du pays où il n y a souvent qu un seul guichet je ne veux juste pas faire de pub gratuite sous votre post,service client,negatif
page_sgci,Appiah Martial N'kesse,2025-04-11,la seule chose qu on vous demande c est l innovation afin de faciliter le quotidien de votre clientèle on en a marre de nous déplacer jusqu à vos guichets automatiques et constater qu ils sont hs surtout à l intérieur du pays où il n y a souvent qu un seul guichet je ne veux juste pas faire de pub gratuite sous votre post,guichet,negatif
page_sgci,Aboubacar Doumbia,2025-08-01,l accueil de sgci d anyama le service est très très lente à l accueil là bas tu viens pour dépôt de la carte magnétique elle te dit de revenu dans trois semaines tu reviens que c est pas a été envoyé tu reviens encore dans deux que ça pas a été envoyer encore,service client,negatif
page_sgci,Aboubacar Doumbia,2025-08-01,l accueil de sgci d anyama le service est très très lente à l accueil là bas tu viens pour dépôt de la carte magnétique elle te dit de revenu dans trois semaines tu reviens que c est pas a été envoyé tu reviens encore dans deux que ça pas a été envoyer encore,carte,negatif
page_sgci,Henri Michel Ndri,2025-04-11,la gestionnaire de bouaké je vous en pris qu elle soit un peu plus courtoise et prenne la peine d écouter le client pour finir des hommes à ce poste franchement c est mieux,service client,negatif
page_sgci,Henri Michel Ndri,2025-04-11,la gestionnaire de bouaké je vous en pris qu elle soit un peu plus courtoise et prenne la peine d écouter le client pour finir des hommes à ce poste franchement c est mieux,gestionnaire,negatif
page_sgci,Jean Guillaume Kadjo,2025-04-11,à quand les transactions mobiles,application,negatif
page_sgci,Tanguy Edmond Kottia,2025-04-11,svp revoyez vos gestionnaires,gestionnaire,negatif
page_sgci,Constant Tchapo,2025-04-25,formez vos conseillers clientèle à une vraie pratique de l exercice bancaire leurs prestations,service client,positif
page_sgci,Constant Tchapo,2025-04-25,formez vos conseillers clientèle à une vraie pratique de l exercice bancaire leurs prestations,gestionnaire,positif
page_sgci,Kone Alyseydou,2025-04-11,les gestionnaires ne répondent pas aux appels,gestionnaire,negatif
page_sgci,Pju L'Heritier Cfa,2025-04-11,j ai une fois appelé pour savoir comment procéder et créer un compte sgc la conseillère m a plus donné de suite je sais pas pourquoi,gestionnaire,negatif
page_sgci,Capitaine Yayouss,2025-04-11,vos conseillers ne sont pas du tout courtois ils se croient supérieurs aux clients veuillez y remédier,service client,negatif
page_sgci,Capitaine Yayouss,2025-04-11,vos conseillers ne sont pas du tout courtois ils se croient supérieurs aux clients veuillez y remédier,gestionnaire,negatif
page_sgci,Joel Gahia,2025-04-11,vos conseillers pensent que sans eux on ne peut pas vivre ils ne décrochent pas les appels pourtant c est à cause des clients qu ils sont là,service client,negatif
page_sgci,Joel Gahia,2025-04-11,vos conseillers pensent que sans eux on ne peut pas vivre ils ne décrochent pas les appels pourtant c est à cause des clients qu ils sont là,gestionnaire,negatif
page_sgci,Hussen Le Bon,2025-04-11,on n a plus envie de parcourir des kilomètres pour retirer nos salaires faites comme les banques sœurs qui ont arrimé les comptes courants et épargnes aux comptes wave orange money flooz et mtn money cela évite beaucoup de problèmes tels que le phénomène des coupeurs de route et les risques d accident de la circulation,virement,positif
page_sgci,Jean Paul Hervé Kouadio,2025-04-11,commencer par inviter vos conseillers clientèles à accueillir les clients respectueusement parler avec courtoisie décrocher les appels des clients ou les rappeler dès que disponibles s ils refusent de traiter les clients comme des rois selon l adage au moins qu ils les acceptent en égaux c,service client,negatif
page_sgci,Jean Paul Hervé Kouadio,2025-04-11,commencer par inviter vos conseillers clientèles à accueillir les clients respectueusement parler avec courtoisie décrocher les appels des clients ou les rappeler dès que disponibles s ils refusent de traiter les clients comme des rois selon l adage au moins qu ils les acceptent en égaux c,gestionnaire,negatif
page_sgci,Jean Paul Hervé Kouadio,2025-04-11,est un préalable indispensable aux affaires et nécessaire à l effet d intéresser et galvaniser la clientèle aux produits bancaires proposés,service client,positif
page_sgci,Yannick Nig Gayaro,2025-04-18,ah moi ma conseillère elle me connait deh que je lance elle décroche la meilleure,gestionnaire,positif
page_sgci,Doufinanbomisso Doufinan,2025-04-18,la société générale côte d ivoire est devenue autres choses non seulement ils ne décrochent pas les appels mais quand tu y arrives personne pour te recevoir tu les vois dans les pantalons serré on dirait les microbes simple carte pour avoir c est difficile surtout à daloa ils reçoivent par connaissance,carte,negatif
page_sgci,Erick Kouame,2025-04-18,moi ce qui m ecoeure vous obligeez les gens a forcement obtenir des cartes magnetiques pourtant,carte,negatif
page_sgci,Zeph Gore Bi,2025-04-18,vos gestionnaires,gestionnaire,negatif
page_sgci,Zeph Gore Bi,2025-04-18,la je veux savoir pourquoi sont ils pas proche des clients,service client,positif
page_sgci,Daniel Konan,2025-04-18,vos agios sont trop élevés de plus la relation client et conseiller n est plus ce qu elle était les appels et autres messages sont sans suite même le retrait de certains documents comme les cartes les chéquiers est un parcours de combattant tout ce qu on sait te dire souscris à sg connect comme si c était gratuit hummm sgci tu me djah,gestionnaire,negatif
page_sgci,Daniel Konan,2025-04-18,vos agios sont trop élevés de plus la relation client et conseiller n est plus ce qu elle était les appels et autres messages sont sans suite même le retrait de certains documents comme les cartes les chéquiers est un parcours de combattant tout ce qu on sait te dire souscris à sg connect comme si c était gratuit hummm sgci tu me djah,frais,negatif
page_sgci,Daniel Konan,2025-04-18,vos agios sont trop élevés de plus la relation client et conseiller n est plus ce qu elle était les appels et autres messages sont sans suite même le retrait de certains documents comme les cartes les chéquiers est un parcours de combattant tout ce qu on sait te dire souscris à sg connect comme si c était gratuit hummm sgci tu me djah,carte,negatif
page_sgci,Daniel Konan,2025-04-18,vos agios sont trop élevés de plus la relation client et conseiller n est plus ce qu elle était les appels et autres messages sont sans suite même le retrait de certains documents comme les cartes les chéquiers est un parcours de combattant tout ce qu on sait te dire souscris à sg connect comme si c était gratuit hummm sgci tu me djah,retrait,negatif
page_sgci,Daniel Konan,2025-04-18,vos agios sont trop élevés de plus la relation client et conseiller n est plus ce qu elle était les appels et autres messages sont sans suite même le retrait de certains documents comme les cartes les chéquiers est un parcours de combattant tout ce qu on sait te dire souscris à sg connect comme si c était gratuit hummm sgci tu me djah,service client,negatif
page_sgci,Daniel Konan,2025-04-18,vos agios sont trop élevés de plus la relation client et conseiller n est plus ce qu elle était les appels et autres messages sont sans suite même le retrait de certains documents comme les cartes les chéquiers est un parcours de combattant tout ce qu on sait te dire souscris à sg connect comme si c était gratuit hummm sgci tu me djah,application,negatif
page_sgci,Lanz Fof,2025-04-11,vous n avez pas encore de liaisons avec les wave money orange money moov et mtn vous allez être dépassé hein ou bien votre conseiller spécial est en congé,gestionnaire,negatif
page_sgci,Konate Brahima,2025-04-18,conseiller client ne répond pas aux appels des clients,service client,negatif
page_sgci,Konate Brahima,2025-04-18,conseiller client ne répond pas aux appels des clients,gestionnaire,negatif
page_sgci,Felix Amon N'Zi,2025-04-11,j ai été débité mon courrier n a pas eu de suite sous prétexte que toute la sous région avais le même soucis de vrai incompétent domicilié au siège a l agence rivrera cap nord j ai honte ou que les guichets sont vieillissants sans qualification ni spécialisation honte à vous je vous attends,agence,negatif
